{
  "$schema": "http://json-schema.org/draft-07/schema#",
  "title": "Application Credentials",
  "description": "Authentication credentials for external services. Supports both user credentials (stored in browser) and system credentials (loaded from environment variables).",
  "type": "object",
  "properties": {
    "version": {
      "type": "string",
      "title": "Schema Version",
      "description": "Version of the credentials schema",
      "default": "1.0.0"
    },
    "defaultGitRepo": {
      "type": "string",
      "title": "Default Git Repository",
      "description": "Name of the default Git repository to use for operations",
      "default": "nous-conversion"
    },
    "git": {
      "type": "array",
      "title": "Git Repository Credentials",
      "description": "Authentication credentials for Git repositories",
      "items": {
        "type": "object",
        "title": "Git Repository Credential",
        "properties": {
          "name": {
            "type": "string",
            "title": "Repository Name",
            "description": "Display name for this repository (used as key for identification)"
          },
          "owner": {
            "type": "string",
            "title": "GitHub Owner",
            "description": "GitHub username or organization name"
          },
          "repo": {
            "type": "string",
            "title": "Repository Name",
            "description": "Name of the repository"
          },
          "token": {
            "type": "string",
            "title": "GitHub Token",
            "description": "Personal access token for GitHub API",
            "format": "password"
          },
          "basePath": {
            "type": "string",
            "title": "Base Path",
            "description": "Optional prefix for directory structure (e.g., 'param-registry' for nested repos)",
            "default": ""
          },
          "branch": {
            "type": "string",
            "title": "Default Branch",
            "description": "Default branch to use for operations",
            "default": "main"
          },
          "graphsPath": {
            "type": "string",
            "title": "Graphs Directory Path",
            "description": "Path to the graphs directory in the repository",
            "default": "graphs"
          },
          "paramsPath": {
            "type": "string",
            "title": "Parameters Directory Path",
            "description": "Path to the parameters directory in the repository",
            "default": "parameters"
          },
          "contextsPath": {
            "type": "string",
            "title": "Contexts Directory Path",
            "description": "Path to the contexts directory in the repository",
            "default": "contexts"
          },
          "casesPath": {
            "type": "string",
            "title": "Cases Directory Path",
            "description": "Path to the cases directory in the repository",
            "default": "cases"
          }
        },
        "required": ["name", "owner", "repo", "token"],
        "additionalProperties": false
      }
    },
    "statsig": {
      "type": "object",
      "title": "Statsig Credentials",
      "description": "Authentication credentials for Statsig integration",
      "properties": {
        "token": {
          "type": "string",
          "title": "Statsig API Key",
          "description": "Console API key for Statsig (full CRUD operations)",
          "format": "password"
        }
      },
      "required": ["token"],
      "additionalProperties": false
    },
    "googleSheets": {
      "type": "object",
      "title": "Google Sheets Credentials",
      "description": "Authentication credentials for Google Sheets integration",
      "properties": {
        "token": {
          "type": "string",
          "title": "Google OAuth Token",
          "description": "OAuth access token for Google Sheets API",
          "format": "password"
        },
        "serviceAccount": {
          "type": "string",
          "title": "Service Account JSON",
          "description": "Base64-encoded service account JSON key for server-side authentication (alternative to OAuth)",
          "format": "password"
        }
      },
      "additionalProperties": false
    },
    "amplitude": {
      "type": "object",
      "title": "Amplitude Credentials",
      "description": "Authentication credentials for Amplitude Analytics integration",
      "properties": {
        "apiKey": {
          "type": "string",
          "title": "Amplitude API Key",
          "description": "API key for Amplitude (for querying analytics data)",
          "format": "password"
        },
        "secretKey": {
          "type": "string",
          "title": "Amplitude Secret Key",
          "description": "Secret key for Amplitude (for authenticated requests)",
          "format": "password"
        },
        "organizationId": {
          "type": "string",
          "title": "Organization ID",
          "description": "Amplitude organization identifier (optional)"
        },
        "projectId": {
          "type": "string",
          "title": "Project ID",
          "description": "Amplitude project identifier (optional)"
        }
      },
      "required": ["apiKey", "secretKey"],
      "additionalProperties": false
    }
  },
  "required": ["git"],
  "additionalProperties": false
}