{
  "version": "1.0.0",
  "defaultGitRepo": "nous-conversion",
  "git": [
    {
      "name": "nous-conversion",
      "owner": "gjbm2",
      "repo": "nous-conversion",
      "token": "ghp_YOUR_GITHUB_TOKEN_HERE",
      "basePath": "",
      "branch": "main",
      "graphsPath": "graphs",
      "paramsPath": "parameters",
      "contextsPath": "contexts",
      "casesPath": "cases"
    }
  ],
  "statsig": {
    "token": ""
  },
  "googleSheets": {
    "token": ""
  }
}
